{
  "schema": {
    "version": 1
  },
  "name": "demo_cossin",
  "grammar": {
    "family": "mutation",
    "real": "cos",
    "imag": "plain",
    "power": 2
  },
  "window": [
    -2.5,
    2.5,
    -2.5,
    2.5
  ],
  "caps": [
    60,
    300,
    1000
  ],
  "gamma": 1.3,
  "notes": "x' = cos(x^2) - y, y' = 2xy \u2014 exported by brot_build aprs",
  "author": "fractal-darkroom seed",
  "created": "2026-10-21T08:24:36+00:00",
  "renderer": "fractal-darkroom",
  "provenance": "authored-on-site",
  "preview": "64c3494e"
}
